{
  "address": "10.0.0.1:20880",
  "alived": 1,
  "application": "my-dubbo-app",
  "collected": "example-value",
  "created": "example-value",
  "expired": "example-value",
  "hash": "example-value",
  "id": 1,
  "ids": [
    1
  ],
  "miss": true,
  "modified": "example-value",
  "now": "example-value",
  "operator": "example-value",
  "operatorAddress": "10.0.0.1:20880",
  "parameters": "example-value",
  "registry": "example-value",
  "result": "example-value",
  "service": "com.example.DemoService",
  "statistics": "example-value",
  "username": "example-service"
}